item_id,verb_id,verb_type,verb,do,pp
582,9,naba-pp,kicked,mommy kicked her the bottle .,mommy kicked the bottle to her .
583,9,naba-pp,kicked,mommy kicked them the bottle .,mommy kicked the bottle to them .
584,9,naba-pp,kicked,daddy kicked me the bottle .,daddy kicked the bottle to me .
585,9,naba-pp,kicked,lily kicked daddy the bottle .,lily kicked the bottle to daddy .
586,9,naba-pp,kicked,david kicked the bear the bottle .,david kicked the bottle to the bear .
587,9,naba-pp,kicked,david kicked the girl the bottle .,david kicked the bottle to the girl .
588,9,naba-pp,kicked,david kicked the man the bottle .,david kicked the bottle to the man .
589,9,naba-pp,kicked,daddy kicked my uncle the bottle .,daddy kicked the bottle to my uncle .
590,9,naba-pp,kicked,john kicked a stranger the bottle .,john kicked the bottle to a stranger .
591,9,naba-pp,kicked,the boy kicked him the slinky .,the boy kicked the slinky to him .
592,9,naba-pp,kicked,david kicked her the slinky .,david kicked the slinky to her .
593,9,naba-pp,kicked,laura kicked them the slinky .,laura kicked the slinky to them .
594,9,naba-pp,kicked,ethan kicked me the slinky .,ethan kicked the slinky to me .
595,9,naba-pp,kicked,laura kicked daddy the slinky .,laura kicked the slinky to daddy .
596,9,naba-pp,kicked,ryan kicked the bear the slinky .,ryan kicked the slinky to the bear .
597,9,naba-pp,kicked,nina kicked the girl the slinky .,nina kicked the slinky to the girl .
598,9,naba-pp,kicked,the boy kicked the man the slinky .,the boy kicked the slinky to the man .
599,9,naba-pp,kicked,daddy kicked my uncle the slinky .,daddy kicked the slinky to my uncle .
600,9,naba-pp,kicked,daddy kicked a stranger the slinky .,daddy kicked the slinky to a stranger .
601,9,naba-pp,kicked,mommy kicked him my large eraser .,mommy kicked my large eraser to him .
602,9,naba-pp,kicked,lily kicked her my large eraser .,lily kicked my large eraser to her .
603,9,naba-pp,kicked,ryan kicked them my large eraser .,ryan kicked my large eraser to them .
604,9,naba-pp,kicked,john kicked me my large eraser .,john kicked my large eraser to me .
605,9,naba-pp,kicked,laura kicked daddy my large eraser .,laura kicked my large eraser to daddy .
606,9,naba-pp,kicked,nina kicked the bear my large eraser .,nina kicked my large eraser to the bear .
607,9,naba-pp,kicked,john kicked the girl my large eraser .,john kicked my large eraser to the girl .
608,9,naba-pp,kicked,john kicked the man my large eraser .,john kicked my large eraser to the man .
609,9,naba-pp,kicked,ethan kicked my uncle my large eraser .,ethan kicked my large eraser to my uncle .
610,9,naba-pp,kicked,grandma kicked a stranger my large eraser .,grandma kicked my large eraser to a stranger .
611,9,naba-pp,kicked,grandma kicked him that .,grandma kicked that to him .
612,9,naba-pp,kicked,john kicked her that .,john kicked that to her .
613,9,naba-pp,kicked,david kicked them that .,david kicked that to them .
614,9,naba-pp,kicked,mommy kicked me that .,mommy kicked that to me .
615,9,naba-pp,kicked,ryan kicked daddy that .,ryan kicked that to daddy .
616,9,naba-pp,kicked,david kicked the bear that .,david kicked that to the bear .
617,9,naba-pp,kicked,adam kicked the girl that .,adam kicked that to the girl .
618,9,naba-pp,kicked,daddy kicked the man that .,daddy kicked that to the man .
619,9,naba-pp,kicked,mommy kicked my uncle that .,mommy kicked that to my uncle .
620,9,naba-pp,kicked,john kicked a stranger that .,john kicked that to a stranger .
621,9,naba-pp,kicked,laura kicked him something .,laura kicked something to him .
622,9,naba-pp,kicked,laura kicked her something .,laura kicked something to her .
623,9,naba-pp,kicked,adam kicked them something .,adam kicked something to them .
624,9,naba-pp,kicked,david kicked me something .,david kicked something to me .
625,9,naba-pp,kicked,adam kicked daddy something .,adam kicked something to daddy .
626,9,naba-pp,kicked,john kicked the bear something .,john kicked something to the bear .
627,9,naba-pp,kicked,ethan kicked the girl something .,ethan kicked something to the girl .
628,9,naba-pp,kicked,daddy kicked the man something .,daddy kicked something to the man .
629,9,naba-pp,kicked,laura kicked my uncle something .,laura kicked something to my uncle .
630,9,naba-pp,kicked,grandma kicked a stranger something .,grandma kicked something to a stranger .
631,10,naba-pp,carried,ryan carried him some boxes .,ryan carried some boxes to him .
632,10,naba-pp,carried,adam carried her some boxes .,adam carried some boxes to her .
633,10,naba-pp,carried,john carried them some boxes .,john carried some boxes to them .
634,10,naba-pp,carried,ethan carried us some boxes .,ethan carried some boxes to us .
635,10,naba-pp,carried,you carried mommy some boxes .,you carried some boxes to mommy .
636,10,naba-pp,carried,david carried the bear some boxes .,david carried some boxes to the bear .
637,10,naba-pp,carried,grandma carried the child some boxes .,grandma carried some boxes to the child .
638,10,naba-pp,carried,you carried the man some boxes .,you carried some boxes to the man .
639,10,naba-pp,carried,john carried my auntie some boxes .,john carried some boxes to my auntie .
640,10,naba-pp,carried,ryan carried a stranger some boxes .,ryan carried some boxes to a stranger .
641,10,naba-pp,carried,david carried him the bags .,david carried the bags to him .
642,10,naba-pp,carried,ethan carried her the bags .,ethan carried the bags to her .
643,10,naba-pp,carried,david carried them the bags .,david carried the bags to them .
644,10,naba-pp,carried,mommy carried us the bags .,mommy carried the bags to us .
645,10,naba-pp,carried,you carried mommy the bags .,you carried the bags to mommy .
646,10,naba-pp,carried,you carried the bear the bags .,you carried the bags to the bear .
647,10,naba-pp,carried,the boy carried the child the bags .,the boy carried the bags to the child .
648,10,naba-pp,carried,lily carried the man the bags .,lily carried the bags to the man .
649,10,naba-pp,carried,david carried my auntie the bags .,david carried the bags to my auntie .
650,10,naba-pp,carried,the boy carried a stranger the bags .,the boy carried the bags to a stranger .
651,10,naba-pp,carried,laura carried him a package .,laura carried a package to him .
652,10,naba-pp,carried,you carried her a package .,you carried a package to her .
653,10,naba-pp,carried,adam carried them a package .,adam carried a package to them .
654,10,naba-pp,carried,you carried us a package .,you carried a package to us .
655,10,naba-pp,carried,david carried mommy a package .,david carried a package to mommy .
656,10,naba-pp,carried,ethan carried the bear a package .,ethan carried a package to the bear .
657,10,naba-pp,carried,laura carried the child a package .,laura carried a package to the child .
658,10,naba-pp,carried,david carried the man a package .,david carried a package to the man .
659,10,naba-pp,carried,david carried my auntie a package .,david carried a package to my auntie .
660,10,naba-pp,carried,nina carried a stranger a package .,nina carried a package to a stranger .
661,10,naba-pp,carried,john carried him the bottle .,john carried the bottle to him .
662,10,naba-pp,carried,mommy carried her the bottle .,mommy carried the bottle to her .
663,10,naba-pp,carried,nina carried them the bottle .,nina carried the bottle to them .
664,10,naba-pp,carried,you carried us the bottle .,you carried the bottle to us .
665,10,naba-pp,carried,david carried mommy the bottle .,david carried the bottle to mommy .
666,10,naba-pp,carried,mommy carried the bear the bottle .,mommy carried the bottle to the bear .
667,10,naba-pp,carried,john carried the child the bottle .,john carried the bottle to the child .
668,10,naba-pp,carried,nina carried the man the bottle .,nina carried the bottle to the man .
669,10,naba-pp,carried,david carried my auntie the bottle .,david carried the bottle to my auntie .
670,10,naba-pp,carried,ryan carried a stranger the bottle .,ryan carried the bottle to a stranger .
671,10,naba-pp,carried,laura carried him the books .,laura carried the books to him .
672,10,naba-pp,carried,nina carried her the books .,nina carried the books to her .
673,10,naba-pp,carried,john carried them the books .,john carried the books to them .
674,10,naba-pp,carried,nina carried us the books .,nina carried the books to us .
675,10,naba-pp,carried,lily carried mommy the books .,lily carried the books to mommy .
676,10,naba-pp,carried,lily carried the bear the books .,lily carried the books to the bear .
677,10,naba-pp,carried,you carried the child the books .,you carried the books to the child .
678,10,naba-pp,carried,ryan carried the man the books .,ryan carried the books to the man .
679,10,naba-pp,carried,ethan carried my auntie the books .,ethan carried the books to my auntie .
680,10,naba-pp,carried,ethan carried a stranger the books .,ethan carried the books to a stranger .
681,10,naba-pp,carried,john carried him those .,john carried those to him .
682,10,naba-pp,carried,adam carried her those .,adam carried those to her .
683,10,naba-pp,carried,laura carried them those .,laura carried those to them .
684,10,naba-pp,carried,ethan carried us those .,ethan carried those to us .
685,10,naba-pp,carried,john carried mommy those .,john carried those to mommy .
686,10,naba-pp,carried,ryan carried the bear those .,ryan carried those to the bear .
687,10,naba-pp,carried,adam carried the child those .,adam carried those to the child .
688,10,naba-pp,carried,adam carried the man those .,adam carried those to the man .
689,10,naba-pp,carried,lily carried my auntie those .,lily carried those to my auntie .
690,10,naba-pp,carried,you carried a stranger those .,you carried those to a stranger .
691,10,naba-pp,carried,david carried him something .,david carried something to him .
692,10,naba-pp,carried,adam carried her something .,adam carried something to her .
693,10,naba-pp,carried,grandma carried them something .,grandma carried something to them .
694,10,naba-pp,carried,john carried us something .,john carried something to us .
695,10,naba-pp,carried,adam carried mommy something .,adam carried something to mommy .
696,10,naba-pp,carried,adam carried the bear something .,adam carried something to the bear .
697,10,naba-pp,carried,the boy carried the child something .,the boy carried something to the child .
698,10,naba-pp,carried,laura carried the man something .,laura carried something to the man .
699,10,naba-pp,carried,grandma carried my auntie something .,grandma carried something to my auntie .
700,10,naba-pp,carried,the boy carried a stranger something .,the boy carried something to a stranger .
701,11,nana-pp,addressed,i addressed us the speech .,i addressed the speech to us .
702,11,nana-pp,addressed,laura addressed her the speech .,laura addressed the speech to her .
703,11,nana-pp,addressed,grandma addressed them the speech .,grandma addressed the speech to them .
704,11,nana-pp,addressed,she addressed me the speech .,she addressed the speech to me .
705,11,nana-pp,addressed,nina addressed mommy the speech .,nina addressed the speech to mommy .
706,11,nana-pp,addressed,i addressed the bear the speech .,i addressed the speech to the bear .
707,11,nana-pp,addressed,mommy addressed the girl the speech .,mommy addressed the speech to the girl .
708,11,nana-pp,addressed,david addressed the man the speech .,david addressed the speech to the man .
709,11,nana-pp,addressed,laura addressed my uncle the speech .,laura addressed the speech to my uncle .
710,11,nana-pp,addressed,david addressed a stranger the speech .,david addressed the speech to a stranger .
711,11,nana-pp,addressed,you addressed us the envelope .,you addressed the envelope to us .
712,11,nana-pp,addressed,mommy addressed her the envelope .,mommy addressed the envelope to her .
713,11,nana-pp,addressed,laura addressed them the envelope .,laura addressed the envelope to them .
714,11,nana-pp,addressed,grandma addressed me the envelope .,grandma addressed the envelope to me .
715,11,nana-pp,addressed,adam addressed mommy the envelope .,adam addressed the envelope to mommy .
716,11,nana-pp,addressed,he addressed the bear the envelope .,he addressed the envelope to the bear .
717,11,nana-pp,addressed,i addressed the girl the envelope .,i addressed the envelope to the girl .
718,11,nana-pp,addressed,lily addressed the man the envelope .,lily addressed the envelope to the man .
719,11,nana-pp,addressed,daddy addressed my uncle the envelope .,daddy addressed the envelope to my uncle .
720,11,nana-pp,addressed,nina addressed a stranger the envelope .,nina addressed the envelope to a stranger .
721,11,nana-pp,addressed,grandma addressed us the gift .,grandma addressed the gift to us .
722,11,nana-pp,addressed,i addressed her the gift .,i addressed the gift to her .
723,11,nana-pp,addressed,grandma addressed them the gift .,grandma addressed the gift to them .
724,11,nana-pp,addressed,ethan addressed me the gift .,ethan addressed the gift to me .
725,11,nana-pp,addressed,he addressed mommy the gift .,he addressed the gift to mommy .
726,11,nana-pp,addressed,mommy addressed the bear the gift .,mommy addressed the gift to the bear .
727,11,nana-pp,addressed,nina addressed the girl the gift .,nina addressed the gift to the girl .
728,11,nana-pp,addressed,daddy addressed the man the gift .,daddy addressed the gift to the man .
729,11,nana-pp,addressed,lily addressed my uncle the gift .,lily addressed the gift to my uncle .
730,11,nana-pp,addressed,ryan addressed a stranger the gift .,ryan addressed the gift to a stranger .
731,11,nana-pp,addressed,you addressed us some packages .,you addressed some packages to us .
732,11,nana-pp,addressed,i addressed her some packages .,i addressed some packages to her .
733,11,nana-pp,addressed,he addressed them some packages .,he addressed some packages to them .
734,11,nana-pp,addressed,adam addressed me some packages .,adam addressed some packages to me .
735,11,nana-pp,addressed,david addressed mommy some packages .,david addressed some packages to mommy .
736,11,nana-pp,addressed,he addressed the bear some packages .,he addressed some packages to the bear .
737,11,nana-pp,addressed,he addressed the girl some packages .,he addressed some packages to the girl .
738,11,nana-pp,addressed,i addressed the man some packages .,i addressed some packages to the man .
739,11,nana-pp,addressed,you addressed my uncle some packages .,you addressed some packages to my uncle .
740,11,nana-pp,addressed,mommy addressed a stranger some packages .,mommy addressed some packages to a stranger .
741,11,nana-pp,addressed,you addressed us my letters .,you addressed my letters to us .
742,11,nana-pp,addressed,ethan addressed her my letters .,ethan addressed my letters to her .
743,11,nana-pp,addressed,laura addressed them my letters .,laura addressed my letters to them .
744,11,nana-pp,addressed,grandma addressed me my letters .,grandma addressed my letters to me .
745,11,nana-pp,addressed,she addressed mommy my letters .,she addressed my letters to mommy .
746,11,nana-pp,addressed,ryan addressed the bear my letters .,ryan addressed my letters to the bear .
747,11,nana-pp,addressed,she addressed the girl my letters .,she addressed my letters to the girl .
748,11,nana-pp,addressed,david addressed the man my letters .,david addressed my letters to the man .
749,11,nana-pp,addressed,ethan addressed my uncle my letters .,ethan addressed my letters to my uncle .
750,11,nana-pp,addressed,ryan addressed a stranger my letters .,ryan addressed my letters to a stranger .
751,11,nana-pp,addressed,grandma addressed us the mail .,grandma addressed the mail to us .
752,11,nana-pp,addressed,david addressed her the mail .,david addressed the mail to her .
753,11,nana-pp,addressed,adam addressed them the mail .,adam addressed the mail to them .
754,11,nana-pp,addressed,grandma addressed me the mail .,grandma addressed the mail to me .
755,11,nana-pp,addressed,the boy addressed mommy the mail .,the boy addressed the mail to mommy .
756,11,nana-pp,addressed,nina addressed the bear the mail .,nina addressed the mail to the bear .
757,11,nana-pp,addressed,david addressed the girl the mail .,david addressed the mail to the girl .
758,11,nana-pp,addressed,nina addressed the man the mail .,nina addressed the mail to the man .
759,11,nana-pp,addressed,laura addressed my uncle the mail .,laura addressed the mail to my uncle .
760,11,nana-pp,addressed,john addressed a stranger the mail .,john addressed the mail to a stranger .
761,11,nana-pp,addressed,adam addressed us that .,adam addressed that to us .
762,11,nana-pp,addressed,daddy addressed her that .,daddy addressed that to her .
763,11,nana-pp,addressed,you addressed them that .,you addressed that to them .
764,11,nana-pp,addressed,she addressed me that .,she addressed that to me .
765,11,nana-pp,addressed,ethan addressed mommy that .,ethan addressed that to mommy .
766,11,nana-pp,addressed,john addressed the bear that .,john addressed that to the bear .
767,11,nana-pp,addressed,lily addressed the girl that .,lily addressed that to the girl .
768,11,nana-pp,addressed,the boy addressed the man that .,the boy addressed that to the man .
769,11,nana-pp,addressed,john addressed my uncle that .,john addressed that to my uncle .
770,11,nana-pp,addressed,grandma addressed a stranger that .,grandma addressed that to a stranger .
771,12,nana-pp,announced,laura announced him the news .,laura announced the news to him .
772,12,nana-pp,announced,nina announced her the news .,nina announced the news to her .
773,12,nana-pp,announced,the boy announced them the news .,the boy announced the news to them .
774,12,nana-pp,announced,she announced me the news .,she announced the news to me .
775,12,nana-pp,announced,adam announced mommy the news .,adam announced the news to mommy .
776,12,nana-pp,announced,adam announced the bear the news .,adam announced the news to the bear .
777,12,nana-pp,announced,i announced the girl the news .,i announced the news to the girl .
778,12,nana-pp,announced,john announced the man the news .,john announced the news to the man .
779,12,nana-pp,announced,ryan announced my uncle the news .,ryan announced the news to my uncle .
780,12,nana-pp,announced,the boy announced a stranger the news .,the boy announced the news to a stranger .
781,12,nana-pp,announced,i announced him the schedule .,i announced the schedule to him .
782,12,nana-pp,announced,daddy announced her the schedule .,daddy announced the schedule to her .
783,12,nana-pp,announced,she announced them the schedule .,she announced the schedule to them .
784,12,nana-pp,announced,john announced me the schedule .,john announced the schedule to me .
785,12,nana-pp,announced,ryan announced mommy the schedule .,ryan announced the schedule to mommy .
786,12,nana-pp,announced,i announced the bear the schedule .,i announced the schedule to the bear .
787,12,nana-pp,announced,mommy announced the girl the schedule .,mommy announced the schedule to the girl .
788,12,nana-pp,announced,nina announced the man the schedule .,nina announced the schedule to the man .
789,12,nana-pp,announced,daddy announced my uncle the schedule .,daddy announced the schedule to my uncle .
790,12,nana-pp,announced,she announced a stranger the schedule .,she announced the schedule to a stranger .
791,12,nana-pp,announced,the boy announced him my thought .,the boy announced my thought to him .
792,12,nana-pp,announced,mommy announced her my thought .,mommy announced my thought to her .
793,12,nana-pp,announced,ryan announced them my thought .,ryan announced my thought to them .
794,12,nana-pp,announced,mommy announced me my thought .,mommy announced my thought to me .
795,12,nana-pp,announced,the boy announced mommy my thought .,the boy announced my thought to mommy .
796,12,nana-pp,announced,mommy announced the bear my thought .,mommy announced my thought to the bear .
797,12,nana-pp,announced,grandma announced the girl my thought .,grandma announced my thought to the girl .
798,12,nana-pp,announced,lily announced the man my thought .,lily announced my thought to the man .
799,12,nana-pp,announced,you announced my uncle my thought .,you announced my thought to my uncle .
800,12,nana-pp,announced,adam announced a stranger my thought .,adam announced my thought to a stranger .
801,12,nana-pp,announced,she announced him the answer .,she announced the answer to him .
802,12,nana-pp,announced,lily announced her the answer .,lily announced the answer to her .
803,12,nana-pp,announced,ryan announced them the answer .,ryan announced the answer to them .
804,12,nana-pp,announced,you announced me the answer .,you announced the answer to me .
805,12,nana-pp,announced,she announced mommy the answer .,she announced the answer to mommy .
806,12,nana-pp,announced,lily announced the bear the answer .,lily announced the answer to the bear .
807,12,nana-pp,announced,grandma announced the girl the answer .,grandma announced the answer to the girl .
808,12,nana-pp,announced,daddy announced the man the answer .,daddy announced the answer to the man .
809,12,nana-pp,announced,adam announced my uncle the answer .,adam announced the answer to my uncle .
810,12,nana-pp,announced,daddy announced a stranger the answer .,daddy announced the answer to a stranger .
811,12,nana-pp,announced,david announced him the new position .,david announced the new position to him .
812,12,nana-pp,announced,ryan announced her the new position .,ryan announced the new position to her .
813,12,nana-pp,announced,adam announced them the new position .,adam announced the new position to them .
814,12,nana-pp,announced,lily announced me the new position .,lily announced the new position to me .
815,12,nana-pp,announced,she announced mommy the new position .,she announced the new position to mommy .
816,12,nana-pp,announced,laura announced the bear the new position .,laura announced the new position to the bear .
817,12,nana-pp,announced,daddy announced the girl the new position .,daddy announced the new position to the girl .
818,12,nana-pp,announced,david announced the man the new position .,david announced the new position to the man .
819,12,nana-pp,announced,i announced my uncle the new position .,i announced the new position to my uncle .
820,12,nana-pp,announced,ethan announced a stranger the new position .,ethan announced the new position to a stranger .
821,12,nana-pp,announced,adam announced him that .,adam announced that to him .
822,12,nana-pp,announced,ethan announced her that .,ethan announced that to her .
823,12,nana-pp,announced,i announced them that .,i announced that to them .
824,12,nana-pp,announced,you announced me that .,you announced that to me .
825,12,nana-pp,announced,she announced mommy that .,she announced that to mommy .
826,12,nana-pp,announced,nina announced the bear that .,nina announced that to the bear .
827,12,nana-pp,announced,the boy announced the girl that .,the boy announced that to the girl .
828,12,nana-pp,announced,mommy announced the man that .,mommy announced that to the man .
829,12,nana-pp,announced,laura announced my uncle that .,laura announced that to my uncle .
830,12,nana-pp,announced,you announced a stranger that .,you announced that to a stranger .
831,12,nana-pp,announced,mommy announced him something .,mommy announced something to him .
832,12,nana-pp,announced,david announced her something .,david announced something to her .
833,12,nana-pp,announced,david announced them something .,david announced something to them .
834,12,nana-pp,announced,adam announced me something .,adam announced something to me .
835,12,nana-pp,announced,laura announced mommy something .,laura announced something to mommy .
836,12,nana-pp,announced,i announced the bear something .,i announced something to the bear .
837,12,nana-pp,announced,the boy announced the girl something .,the boy announced something to the girl .
838,12,nana-pp,announced,nina announced the man something .,nina announced something to the man .
839,12,nana-pp,announced,lily announced my uncle something .,lily announced something to my uncle .
840,12,nana-pp,announced,daddy announced a stranger something .,daddy announced something to a stranger .
841,13,nana-pp,described,david described him my day .,david described my day to him .
842,13,nana-pp,described,ethan described her my day .,ethan described my day to her .
843,13,nana-pp,described,you described us my day .,you described my day to us .
844,13,nana-pp,described,laura described mommy my day .,laura described my day to mommy .
845,13,nana-pp,described,david described daddy my day .,david described my day to daddy .
846,13,nana-pp,described,david described the bear my day .,david described my day to the bear .
847,13,nana-pp,described,daddy described the girl my day .,daddy described my day to the girl .
848,13,nana-pp,described,i described the woman my day .,i described my day to the woman .
849,13,nana-pp,described,he described my uncle my day .,he described my day to my uncle .
850,13,nana-pp,described,grandma described a stranger my day .,grandma described my day to a stranger .
851,13,nana-pp,described,laura described him the story .,laura described the story to him .
852,13,nana-pp,described,he described her the story .,he described the story to her .
853,13,nana-pp,described,lily described us the story .,lily described the story to us .
854,13,nana-pp,described,david described mommy the story .,david described the story to mommy .
855,13,nana-pp,described,john described daddy the story .,john described the story to daddy .
